{"active_behavior_authorization":false,"aggregates":[{"axis_id":"application_send_batch_formation","behavior_catalog_version":1,"byte_count":100,"connection_key":"connection.fixture.1","effective_behavior_id":"behavior.application_send_batch_formation.single_eligible.prefix","epoch_sequence":1,"error_count":0,"fallback_count":0,"inactive_count":0,"operation_count":1,"run_id":"run.correctness.fixture","source_operation_ids":[1001],"unclassifiable_count":0,"work_count":1}],"behavior_catalog_ref":{"document_id":"adaptive_runtime_effective_behavior_catalog_v1","schema_version":"adaptive-runtime-effective-behavior-catalog-v1","document_version":1,"content_sha256":"0d6346d8edd074c20e460b52308913276783008d5078829b1a937f2990f52656"},"content_sha256":"48475c0c25b290b68c57cfa20164ddfbc7e2492c75240cd3a48fd4b07fe96960","document_id":"materialization.batch.distinct","document_version":1,"performance_acceptance_authorization":false,"retained_classifications":[{"classification_id":"classification.1001.analytically_eligible","kind":"analytically_eligible","operation_id":1001,"retained":true}],"schema_version":"adaptive-runtime-effective-behavior-materialization-v1","source_evidence_ref":{"document_id":"batch.distinct","schema_version":"adaptive-runtime-operation-evidence-v1","document_version":1,"content_sha256":"e0535987ea56320b53a153b7e38240c140fe713b16c23436ddbbeb35d4ff9968"},"trace_references":{"architecture_ids":["ARC-QUIC-CRT-0095"],"requirement_ids":["REQ-QUIC-CRT-0206","REQ-QUIC-CRT-0207","REQ-QUIC-CRT-0208","REQ-QUIC-CRT-0209"],"verification_ids":["VER-QUIC-CRT-0097"],"work_item_ids":["WI-QUIC-CRT-0096"]}}